,date,headline,abstract,lead_paragraph,url
0,2019-08-14 16:22:02+00:00,"Trade Tensions and a Weaker Yuan Drive Chinese Crypto Demand, Market Players Say","Trade tensions between the United States and China and a weakening yuan are boosting demand for cryptocurrencies among Chinese investors, market players from Asia to New York said.","LONDON/NEW YORK — Trade tensions between the United States and China and a weakening yuan are boosting demand for cryptocurrencies among Chinese investors, market players from Asia to New York said.",https://www.nytimes.com/reuters/2019/08/14/business/14reuters-crypto-currencies.html
1,2019-08-14 10:33:39+00:00,Barclays Ends Partnership With Cryptocurrency Exchange Coinbase: Sources,"Barclays is no longer providing banking services to major cryptocurrency exchange Coinbase, sources familiar with the matter told Reuters, ending a relationship that started in March last year as the exchange expanded in Europe.","LONDON — Barclays is no longer providing banking services to major cryptocurrency exchange Coinbase, sources familiar with the matter told Reuters, ending a relationship that started in March last year as the exchange expanded in Europe.",https://www.nytimes.com/reuters/2019/08/14/business/14reuters-barclays-coinbase.html
2,2019-08-14 10:00:04+00:00,"They Stole Your Files, You Don’t Have to Pay the Ransom",The F.B.I. should follow the example of European law enforcement and help victims of ransomware decrypt their data.,"In July, Europol celebrated the third anniversary of its No More Ransom initiative, announcing that the public-private partnership had helped more than 200,000 ransomware victims recover their files using its library of freely available online tools instead of giving in to hackers’ demands to pay a cryptocurrency ransom. All told, the recovered files saved victims some $108 million in ransom, according to Europol, the European Union’s police agency.",https://www.nytimes.com/2019/08/14/opinion/ransomware.html
3,2019-08-13 06:06:40+00:00,European Blockchain Company Bitfury Launches Artificial Intelligence Unit,"European blockchain company The Bitfury Group, valued recently at more than $1 billion, has launched its artificial intelligence (AI) division, the company's top official told Reuters in an interview. ","NEW YORK — European blockchain company The Bitfury Group, valued recently at more than $1 billion, has launched its artificial intelligence (AI) division, the company's top official told Reuters in an interview. ",https://www.nytimes.com/reuters/2019/08/13/business/13reuters-usa-blockchain-bitfury.html
4,2019-08-12 12:15:47+00:00,"IBM, India's Tata Join U.S. Tech Platform's Governing Council","International Business Machines Corp and Tata Communications have joined the governing council of Hedera Hashgraph, a distributed public ledger platform that aims to be faster and runs at a larger scale than current blockchain technologies, a top official at Hedera said.","NEW YORK — International Business Machines Corp and Tata Communications have joined the governing council of Hedera Hashgraph, a distributed public ledger platform that aims to be faster and runs at a larger scale than current blockchain technologies, a top official at Hedera said.",https://www.nytimes.com/reuters/2019/08/12/business/12reuters-usa-blockchain-ibm.html
5,2019-08-12 08:12:35+00:00,Take Five: The Devil's in the Data,LONDON (Reuters) - ,LONDON (Reuters) - ,https://www.nytimes.com/reuters/2019/08/12/business/12reuters-global-markets-themes-graphic.html
6,2019-08-09 19:28:00+00:00,Take Five: The Devil's in the Data,1/ READY FOR A SCARY EURO ZONE GDP SHOW? ,LONDON — 1/ READY FOR A SCARY EURO ZONE GDP SHOW? ,https://www.nytimes.com/reuters/2019/08/09/business/09reuters-global-markets-themes-graphic.html
7,2019-08-09 18:46:07+00:00,Take Five: The Devil's in the Data,1/ READY FOR A SCARY EURO ZONE GDP SHOW? ,LONDON — 1/ READY FOR A SCARY EURO ZONE GDP SHOW? ,https://www.nytimes.com/reuters/2019/08/09/business/09reuters-global-markets-themes.html
8,2019-08-07 10:07:22+00:00,"DealBook Briefing: China vs. U.S. Could Be a Long, Slow Grind","Its economy struggling, China may try to inflict maximum political damage, even hoping that a prolonged trade war could derail President Trump’s re-election campaign.",Good Wednesday. (Want this by email? Sign up here.),https://www.nytimes.com/2019/08/07/business/dealbook/china-us-trade.html
9,2019-08-07 03:28:02+00:00,"Bitcoin as a Safe Haven? More a Speculative Bet, Market Players Say","Bitcoin's recent gains as stocks plummeted on U.S.-China trade tensions reflect not so much its safe-haven credentials but its potential for quick gains, cryptocurrency and foreign exchange traders said on Tuesday.","LONDON — Bitcoin's recent gains as stocks plummeted on U.S.-China trade tensions reflect not so much its safe-haven credentials but its potential for quick gains, cryptocurrency and foreign exchange traders said on Tuesday.",https://www.nytimes.com/reuters/2019/08/06/business/06reuters-crypto-currencies.html
10,2019-08-05 21:24:33+00:00,UN Report: North Korea Cyber Experts Raised Up to $2 Billion,"A panel monitoring U.N. sanctions says North Korean cyber experts have illegally raised money for the country's weapons of mass destruction programs ""with total proceeds to date estimated at up to $2 billion.""","UNITED NATIONS — A panel monitoring U.N. sanctions says North Korean cyber experts have illegally raised money for the country's weapons of mass destruction programs ""with total proceeds to date estimated at up to $2 billion.""",https://www.nytimes.com/aponline/2019/08/05/world/asia/ap-un-united-nations-north-korea-sanctions.html
11,2019-08-02 22:30:57+00:00,Apple Card Will Not Allow Purchase of Cryptocurrencies,"The Apple Inc credit card being launched with Goldman Sachs Group Inc will not allow the purchase of cryptocurrencies with the card, according to a customer agreement posted to Goldman's website on Friday.","(Reuters) - The Apple Inc credit card being launched with Goldman Sachs Group Inc will not allow the purchase of cryptocurrencies with the card, according to a customer agreement posted to Goldman's website on Friday.",https://www.nytimes.com/reuters/2019/08/02/business/02reuters-apple-goldman-sachs-consumers-crypto.html
12,2019-08-02 16:57:25+00:00,Vermont Man Gets 5 Years for Dark Web Drug Dealing,A Vermont man was sentenced to five years in federal prison Friday for a drug dealing and money laundering conviction that grew from the Justice Department's first undercover operation targeting dark web drug sales across the country.,"BURLINGTON, Vt. — A Vermont man was sentenced to five years in federal prison Friday for a drug dealing and money laundering conviction that grew from the Justice Department's first undercover operation targeting dark web drug sales across the country.",https://www.nytimes.com/aponline/2019/08/02/us/ap-us-dark-web-drug-sales.html
13,2019-07-28 20:42:09+00:00,Hackers’ Latest Target: School Districts,"Schools handle a lot of personal data and may not have strong technology teams, leaving them vulnerable to attacks, experts say.","Some hackers demand ransom; others sweep up personal data for sale to identity thieves. But whatever hackers’ motives, school systems around the country have been the targets of their cyberattacks.",https://www.nytimes.com/2019/07/28/us/hacker-school-cybersecurity.html
14,2019-07-26 13:00:08+00:00,"Want to Own a Warhol? Now, You Can Buy a Piece of One","Several technology companies are packaging rare cars, paintings and other luxury items as investments, allowing any collector to buy shares in them.","High-price luxury items like sports cars, fine art and even rare first-edition books are generally beyond the reach of average collectors.",https://www.nytimes.com/2019/07/26/your-money/luxury-cars-investment.html
15,2019-07-24 19:16:30+00:00,Strippers Are Doing It for Themselves,An industry organizes against decades of exploitation.,"Around 10 most nights, Nikeisah Newton hops into her car for a 10-minute drive into downtown Portland, Ore., so that she can deliver healthy meals that include ingredients like massaged kale to strippers working the evening shift. “One of the best forms of activism is feeding people,” Ms. Newton said. Her company is called Meals 4 Six Inch Heels, and it’s intended to support a community that she feels has been shunned and taken advantage of for too long. ",https://www.nytimes.com/2019/07/24/style/strip-clubs.html
16,2019-07-24 16:19:33+00:00,"Who Cancels Lunch With Warren Buffett? A Chinese Tycoon Did, but Why?","Justin Sun denied reports that he had postponed a charity lunch with the investing guru after attracting regulatory scrutiny. In China, where executives sometimes vanish, such reports are not unusual.","BEIJING — Everybody knew where Justin Sun, a brash Chinese millionaire and cryptocurrency celebrity, was going to be this week. He had paid a record $4.6 million to have a charity lunch with Warren Buffett, the investing guru, in San Francisco, and he was counting down the days on social media.",https://www.nytimes.com/2019/07/24/business/china-buffett-justin-sun-cryptocurrency.html
17,2019-07-23 18:34:41+00:00,‘South Side’ and ‘Sherman’s Showcase’: Two Flavors of Nostalgia,One is an affectionately traditional sitcom; the other is a metafictional history of four decades of pop culture. Both were created by Diallo Riddle and Bashir Salahuddin.,"The writers, producers and performers Diallo Riddle and Bashir Salahuddin like to cover their comedic bets. On Wednesday, Comedy Central is premiering “South Side,” their amiable new sitcom set in the working-class Chicago neighborhood of Englewood. But wait, there’s more: The following Wednesday, IFC is premiering “Sherman’s Showcase,” their high-concept vaudeville act that takes the form of a tribute to a fictional variety show at the intersection of “Soul Train,” “Laugh-In” and late-night cable-access.",https://www.nytimes.com/2019/07/23/arts/television/south-side-shermans-showcase-review.html
18,2019-07-16 23:20:11+00:00,"Tech Hearings: Congress Unites to Take Aim at Amazon, Apple, Facebook and Google",A series of hearings on Capitol Hill showed the rising force of the political backlash against the country’s tech giants.,"WASHINGTON — Lawmakers leveled stinging criticism and sharp questions at Big Tech executives on Tuesday, attacking Amazon, Apple, Facebook and Google for their market power, their perceived bias as gatekeepers of communication and Facebook’s ambitions to reshape the financial industry.",https://www.nytimes.com/2019/07/16/technology/big-tech-antitrust-hearing.html
19,2019-07-16 15:11:34+00:00,Facebook Cryptocurrency Plans Have a Problem: Facebook’s Reputation,Lawmakers raised broad concerns about the company’s Libra effort at a Senate hearing on Tuesday.,Lawmakers made it clear at a Senate Banking Committee hearing on Tuesday that they believe the biggest roadblock to Facebook’s plan to enter the world of cryptocurrency and global finance is the company’s reputation.,https://www.nytimes.com/2019/07/16/technology/facebook-libra-congress.html
20,2019-07-15 23:14:52+00:00,"Cryptocurrencies Pose National Security Threat, Mnuchin Says","The Treasury secretary raised concerns about cryptocurrencies, including Facebook’s Libra, saying they could be used to fund illicit activities.","WASHINGTON — Treasury Secretary Steven Mnuchin said on Monday that he had “very serious concerns” about cryptocurrencies, including the one being developed by Facebook, the latest indication that Washington is preparing to exert its power over digital currencies.",https://www.nytimes.com/2019/07/15/us/politics/mnuchin-facebook-libra-risk.html
21,2019-07-15 19:28:09+00:00,How to Stay Financially Stable When the World Might Be Falling Apart,"Trade wars, climate change and slowing economic growth can mean severe trouble. So what’s a long-term investor to do?","Unfortunately, rising markets aren’t necessarily great indicators of a healthy economy. ",https://www.nytimes.com/2019/07/15/your-money/how-financially-stable-investing.html
22,2019-07-12 10:07:29+00:00,DealBook Briefing: Why Are Stocks Still Rising?,"Economic fears are climbing — but so are the markets, with the S&P 500 and the Dow Jones industrial average both setting records yesterday.",Good Friday morning. (Was this email forwarded to you? Sign up here.),https://www.nytimes.com/2019/07/12/business/dealbook/record-markets-threats.html
23,2019-07-12 09:15:05+00:00,Facebook’s Digital Money Could Mean Fabulous Wealth. Or Not.,"The social network is planning a new cryptocurrency, potentially inserting the company into yet another part of our lives. Our reporter wonders: What’s in it for me?","Jack Ma, a co-founder of Alibaba,  was recently asked about the secret of his success. “I know nothing about technology,” he said. “I know nothing about marketing.” He said what he knows about is people. A successful business, he said, is all about making people happy.",https://www.nytimes.com/2019/07/12/business/facebook-money-wealth-alibaba.html
24,2019-07-10 18:56:21+00:00,Fed Chair Raises ‘Serious Concerns’ About Facebook’s Cryptocurrency Project,"Jerome Powell, the chair of the Federal Reserve, was the latest central banker to express skepticism about Facebook’s cryptocurrency plans.","Facebook is facing a growing chorus of doubts about its new Libra cryptocurrency project from authorities around the world, ahead of two congressional hearings on the initiative next week.",https://www.nytimes.com/2019/07/10/technology/fed-chair-facebook-cryptocurrency-libra.html
25,2019-07-09 18:57:06+00:00,"To Save Her Abducted Daughter, This Heroine Has to Kidnap a New Victim","“The Chain,” Adrian McKinty‘s existential thriller, imagines a crime syndicate operating a string of abductions like a chain letter, in which victims are themselves pushed to do evil.","It took four countries, three continents, a couple of careers, philosophy studies at Oxford, serious writing awards and major gonna-make-you-a-star-kid machinations in several fields of endeavor to yield this opening sentence from Adrian McKinty:",https://www.nytimes.com/2019/07/09/books/review-chain-adrian-mckinty.html
26,2019-07-09 17:38:53+00:00,"Fix Your Finances, Simply. Try the 7-Day Money Challenge.",Tackle a simple money task each day for a week to strengthen your financial well-being.,"Getting your finances in order is rarely top of mind, especially during the summer, when there are beaches to recline on produce-laden farmer’s markets to browse and vacation plans on which to splurge.",https://www.nytimes.com/2019/07/09/well/fix-your-finances-simply-try-the-7-day-money-challenge.html
27,2019-07-07 07:00:07+00:00,A City Paid a Hefty Ransom to Hackers. But Its Pains Are Far From Over.,"Weeks after Lake City, Fla., was hit by a cyberattack, the phones are back on and email is working, but the city has not yet recovered all its files.","LAKE CITY, Fla. — Audrey Sikes, city clerk of Lake City, Fla., has a thing for documents: She does not like losing them.",https://www.nytimes.com/2019/07/07/us/florida-ransom-hack.html
28,2019-07-06 00:49:32+00:00,Selling Your Private Information Is a Terrible Idea,"We don’t allow people to sell their kidneys. We shouldn’t let them sell the details of their lives, either.","“Claim Your 31st Right,” declares the #My31 app’s splash screen. “Review, share, and confirm your HUMAN right to your data as your property.”",https://www.nytimes.com/2019/07/05/opinion/health-data-property-privacy.html
29,2019-07-05 09:54:02+00:00,DealBook Briefing: Deutsche Bank’s Bloodletting May Soon Begin,"The embattled German lender’s board is expected to vote as soon as Sunday on an extensive turnaround plan that could lead to 20,000 layoffs.",Good Friday. (Want this by email? Sign up here.),https://www.nytimes.com/2019/07/05/business/dealbook/deutsche-bank-turnaround.html
30,2019-07-05 09:00:10+00:00,"In ‘Drill,’ Hito Steyerl Adds Polish to Images of a World Gone Mad","A new commission at the Park Avenue Armory confirms her unrivaled gaze on technology, politics and war.","Visitors to the Park Avenue Armory, the crenelated citadel that takes up an entire city block on the Upper East Side, are accustomed to seeing its cavernous Drill Hall retrofitted with bleachers and sales booths, dance floors, even tennis courts. But Hito Steyerl, the German artist and philosopher of our present technological debasement, has left the space largely empty, illuminated only by some lighting underfoot and three massive screens. In this inky vastness, you can remember that what’s now a palatial arts center was once meant for something else. The building we’re in is “quite literally a fortress,” an onscreen guide tells us, and beneath our feet is “a shooting gallery.”",https://www.nytimes.com/2019/07/05/arts/design/hito-steyerl-drill-armory.html
31,2019-07-01 10:30:59+00:00,DealBook Briefing: Trump Gives Huawei a Breather. Sort of.,"Suspending a ban on U.S. sales to the technology giant could be good news for the Chinese company, but it underlines flaws in Washington’s strategy.",Good Monday. (Was this email forwarded to you? Sign up here.),https://www.nytimes.com/2019/07/01/business/dealbook/huawei-trade-5g.html
32,2019-06-30 10:00:28+00:00,DealBook Special: Wall Street’s Unexpectedly Hot First Half of 2019,"Despite threats like slowing global growth and trade wars, business is booming in the financial sector. Here’s a rundown on the past six months.","Good Sunday morning, and welcome to a special edition of the DealBook Briefing where we’ll take a look at how Wall Street and the wider world of finance has performed during the first six months of 2019. (Was this email forwarded to you? Sign up here.)",https://www.nytimes.com/2019/06/30/business/dealbook/first-half-ipo-markets-mergers.html
33,2019-06-29 18:30:07+00:00,The Worm That Nearly Ate the Internet,It infected 10 million computers. So why did cybergeddon never arrive?,"Just over 10 years ago, a unique strain of malware blitzed the internet so rapidly that it shocked cybersecurity experts worldwide. Known as Conficker, it was and remains the most persistent computer worm ever seen, linking computers with Microsoft operating systems globally, millions of them, to create a vast illicit botnet, in effect, a black-market supercomputer. That much power controlled by its unknown maker posed an existential threat not just to any enterprise connected to the web, but to the internet itself.",https://www.nytimes.com/2019/06/29/opinion/sunday/conficker-worm-ukraine.html
34,2019-06-28 13:00:04+00:00,The Week in Tech: Can You Put a Price on Your Personal Data?,New legislation could tell you how much your data is worth. But you might be disappointed by the price tag.,"Each week, we review the week’s news, offering analysis about the most important developments in the tech industry. Want this newsletter in your inbox? Sign up here.",https://www.nytimes.com/2019/06/28/technology/data-price-big-tech.html
35,2019-06-28 09:58:31+00:00,DealBook Briefing: A Moment of Truth for a Trade Deal,All eyes are on a pivotal meeting between President Trump and President Xi Jinping of China at the G-20.,Good Friday. (Want this by email? Sign up here.),https://www.nytimes.com/2019/06/28/business/dealbook/g20-trade.html
36,2019-06-28 09:00:08+00:00,"Talking to Neal Stephenson, Whose New Novel, ‘Fall,’ is at No. 14","“Unlike some of my hard science fiction books, such as ‘Seveneves’ — where I sweated the details of orbits, rocket engines, etc. — ‘Fall’ is meant to be read as more of a fable,” he says.","There’s some real movement on the fiction list this week: “Where the Crawdads Sing,” which has been ensconced at No. 1 for months, has been bumped to No. 2 by Elin Hilderbrand’s “Summer of ’69,” while Taffy Brodesser-Akner’s debut, “Fleishman Is in Trouble,” enters the list at No. 10. Neal Stephenson’s heady “Paradise Lost”-inspired epic, “Fall; or, Dodge in Hell,” sits at No. 14.",https://www.nytimes.com/2019/06/28/books/review/best-seller-neal-stephenson-fall.html
37,2019-06-27 17:21:29+00:00,"Another Hacked Florida City Pays a Ransom, This Time for $460,000",Lake City became the second Florida city in two weeks to agree to pay a large ransom demanded by hackers who shut down public computer systems.,"MIAMI — Even the phones went down in the government of Lake City, Fla., after hackers launched a cyberattack that disabled the city’s computer systems.",https://www.nytimes.com/2019/06/27/us/lake-city-florida-ransom-cyberattack.html
38,2019-06-26 09:58:32+00:00,DealBook Briefing: Sidestepping the Huawei Ban,"U.S. chip makers are still selling products to Huawei, despite a Trump administration ban on the sale of American technology to the Chinese company.",Good Wednesday. (Want this by email? Sign up here.),https://www.nytimes.com/2019/06/26/business/dealbook/huawei-china-trade.html
39,2019-06-25 23:28:01+00:00,Regulators Have Doubts About Facebook Cryptocurrency. So Do Its Partners.,The social media company said it had signed 27 partners to its Libra project. But executives at some of those companies said they were approaching it warily.,"SAN FRANCISCO — One of the biggest selling points of Facebook’s ambitious plans for its new cryptocurrency, Libra, was that the social media company had 27 partners, including prominent outfits like Visa, Mastercard and Uber, helping out on the project.",https://www.nytimes.com/2019/06/25/technology/facebook-libra-cryptocurrency.html
40,2019-06-25 02:17:56+00:00,Las principales noticias del martes,"El muro mexicano, piratería punto com y el doble discurso de Adidas: lo que está sucediendo en América Latina y el mundo.","Buen día, bienvenido al boletín diario de The New York Times en Español. Si aún no te has suscrito, puedes darte de alta en este enlace.",https://www.nytimes.com/es/2019/06/24/universal/es/el-times-noticias-martes.html
41,2019-06-24 10:37:08+00:00,DealBook Briefing: New Tech Clampdowns Could Threaten a U.S.-China Trade Deal,America continues to undermine Chinese access to U.S. technology. That could loom over impending talks between President Trump and President Xi Jinping of China.,Good Monday. (Want this by email? Sign up here.),https://www.nytimes.com/2019/06/24/business/dealbook/china-tech-trade.html
42,2019-06-22 16:51:34+00:00,"The Week in Business: Stocks Hit a Record High, and Facebook Wants to Replace Your Bank","Plus, tensions with Iran reach a boiling point and Trump’s meeting with China’s president.","Here’s your quick rundown of the week’s biggest stories in business and tech, so you can spend more of your weekend hours enjoying the sun on the longest days of the year. (Or, you know, sit inside and watch season 2 of “Dark” on Netflix. You do you.)",https://www.nytimes.com/2019/06/22/business/the-week-in-business-stocks-facebook-trade.html
43,2019-06-20 19:04:14+00:00,The Real Reason for Facebook’s New Cryptocurrency,"It’s not about banking. Libra is the social network’s last, best hope to regain public trust.","Facebook says its new cryptocurrency, Libra, is a tool for financial inclusion and disrupting the world’s cumbersome payment systems. In reality, there is a deeper motivation behind it, although not the one its critics imagine: Libra is the last, best hope to re-establish trust between Facebook and the world.",https://www.nytimes.com/2019/06/20/opinion/facebook-libra-cryptocurrency.html
44,2019-06-19 23:11:56+00:00,"Hit by Ransomware Attack, Florida City Agrees to Pay Hackers $600,000","Riviera Beach, Fla., authorized its insurer to pay a Bitcoin ransom to hackers who have paralyzed the city’s computer systems for three weeks.","MIAMI — The leaders of Riviera Beach, Fla., looking weary, met quietly this week for an extraordinary vote to pay nearly $600,000 in ransom to hackers who paralyzed the city’s computer systems.",https://www.nytimes.com/2019/06/19/us/florida-riviera-beach-hacking-ransom.html
45,2019-06-19 15:00:04+00:00,"Launching a Global Currency Is a Bold, Bad Move for Facebook","The way we structure money and payments is a question for democratic institutions, not technology companies.","On Tuesday, Facebook, in partnership with a surfeit of other large and powerful corporations, including Uber, Spotify, PayPal and VISA, announced that it would lead the effort to create a new global currency called Libra. “We believe,” says the organization that will govern the currency, “that the world needs a global, digitally native currency that brings together the attributes of the world’s best currencies: stability, low inflation, wide global acceptance and fungibility.”",https://www.nytimes.com/2019/06/19/opinion/facebook-currency-libra.html
46,2019-06-18 20:10:28+00:00,"Hong Kong, Iran, Christchurch: Your Wednesday Briefing",Could Christchurch have been prevented?,(Want to get this briefing by email? Here’s the sign-up.),https://www.nytimes.com/2019/06/18/briefing/your-wednesday-briefing.html
47,2019-06-18 10:07:18+00:00,DealBook Briefing: Say Hello to Facebook’s Cryptocurrency,"Facebook has unveiled its ambitious and hotly anticipated plan to create an alternative financial system, but critics abound.",Good Tuesday. (Want this by email? Sign up here.),https://www.nytimes.com/2019/06/18/business/dealbook/facebook-cryptocurrency-libra.html
48,2019-06-18 09:12:08+00:00,"Donald Trump, Facebook, Harvard: Your Tuesday Briefing",Here’s what you need to know.,(Want to get this briefing by email? Here’s the sign-up.),https://www.nytimes.com/2019/06/18/briefing/donald-trump-facebook-harvard.html
