,date,headline,abstract,lead_paragraph,url
863,2015-05-18 11:23:38+00:00,Morning Agenda: Why Hedge Funds are Closing,Why Hedge Funds are Closing | Remington Investors Get Chance to Cash Out | Chocolate Retailer’s C.F.O. Recalls Fake Takeover Bid,"WHY HEDGE FUNDS ARE CLOSING | Increased regulation, volatile markets and heightened investor scrutiny have prompted hedge funds to close their operations in recent months to focus on managing their own wealth, Alexandra Stevenson writes in DealBook. Shutdowns in the industry are not new – in past years, titans like George Soros and Stanley F. Druckenmiller have closed their hedge funds to manage their own money – but these days, hedge fund managers are complaining about external factors that make it more difficult to make money, like the regulatory changes brought about by the Dodd-Frank Act. For Gideon King, of Loeb King Capital Management, running a hedge fund had just become “too cumbersome,” as he said in January in a letter to investors. “As the endless quest for becoming institutional continues on, the soul of investing might get lost, as the unmitigated compliance processes become cumbersome and interfere with the purity of speculative contemplation,” he wrote.",https://news.blogs.nytimes.com/2015/05/18/morning-agenda-why-hedge-funds-are-closing/
864,2015-05-15 13:21:02+00:00,Daily Report: Unearthing the Enigma of Bitcoin’s Birth,"Conversations with those most deeply involved in Bitcoin yielded a quiet but widely held consensus, and new hints drew an investigator further into the chase.",It is one of the great mysteries of the digital age.,https://bits.blogs.nytimes.com/2015/05/15/daily-report-unearthing-the-enigma-of-bitcoins-birth/
865,2015-05-15 10:00:21+00:00,Decoding the Enigma of Satoshi Nakamoto and the Birth of Bitcoin,Conversations with those most deeply involved in Bitcoin yielded a quiet consensus about the possible identity of the virtual currency’s creator.,It is one of the great mysteries of the digital age.,https://www.nytimes.com/2015/05/17/business/decoding-the-enigma-of-satoshi-nakamoto-and-the-birth-of-bitcoin.html
866,2015-05-14 22:02:54+00:00,Spare Times for May 15-21,"A listing of discussions, film screenings, cultural activities and walking tours in New York City.","A listing of discussions, film screenings, cultural activities and walking tours in New York City.",https://www.nytimes.com/2015/05/15/arts/spare-times-for-may-15-21.html
867,2015-05-11 11:17:35+00:00,Morning Agenda: Speedy Start-Up Financing,Speedy Start-Up Financing | Central Bank and I.M.F. Loom Over Greece Talks | DTZ to Buy Cushman & Wakefield for $2 Billion | China Cuts Benchmark Rate,"SPEEDY START-UP FINANCING | Uber’s most recent fund-raising talks are notable not just for the $50 billion valuation that would come with a $1.5 billion round of financing, but also for amount of time that has lapsed in between rounds — just five months. Uber and other start-ups have been raising money at a pace that is unprecedented in Silicon Valley, “driven by money pouring in from hedge funds, strategic investors and more, and by the willingness of entrepreneurs to embrace the cash,” Mike Isaac and Michael J. de la Merced write in The New York Times. Mark Suster, a partner at the venture capital firm Upfront Ventures, said there’s only one reason these companies are raising money so quickly: Because they can. “When capital markets are this loose, people tap them, whether it’s right to or not,” he said. ",https://news.blogs.nytimes.com/2015/05/11/morning-agenda-speedy-start-up-financing/
868,2015-05-08 11:27:36+00:00,Morning Agenda: 2 Banks Agree to Erase Zombie Debts,2 Banks Agree to Erase Zombie Debts | Syngenta Rejects Monsanto’s $45 Billion Bid | Jonathan Steinberg’s Rebirth | British Pound and Stocks Gain on Election Results,"2 BANKS AGREE TO ERASE ZOMBIE DEBTS  | Some of the nation’s biggest banks have come under fire for keeping debts alive on credit reports even when they were discharged in bankruptcy, essentially forcing borrowers to make payments on bills that they do not legally owe, as Jessica Silver-Greenberg of DealBook reported last year. Relief may finally be at hand for the consumers whose discharged debts have kept them from getting jobs or renting apartments, now that Bank of America and JPMorgan Chase have agreed to update borrowers’ credit reports within the next three months to reflect that the debts were extinguished, Ms. Silver-Greenberg reports in DealBook. ",https://news.blogs.nytimes.com/2015/05/08/morning-agenda-2-banks-agree-to-erase-zombie-debts/
869,2015-05-07 16:59:50+00:00,Winner in Race Among Bitcoin Exchanges,"Chad Cascarilla, the chief executive of itBit, on becoming the first Bitcoin exchange allowed to open legally to customers across the United States.","Chad Cascarilla, the chief executive of itBit, on becoming the first Bitcoin exchange allowed to open legally to customers across the United States.",https://www.nytimes.com/video/business/dealbook/100000003671652/winner-in-race-among-bitcoin-exchanges.html
870,2015-05-07 15:01:24+00:00,Bitcoin Exchange Receives First License in New York State,"The exchange, itBit, said it was taking on customers after receiving a banking trust charter from Benjamin Lawsky, the state’s financial regulator.","New York State’s top financial regulator has granted the first license to a Bitcoin exchange, allowing it to open legally to customers across the country.",https://www.nytimes.com/2015/05/08/business/dealbook/bitcoin-exchange-receives-first-license-in-new-york-state.html
871,2015-05-04 11:07:04+00:00,Morning Agenda: Britain’s Conservatives Get Hedge Funds’ Vote,Britain’s Conservatives Get Hedge Funds’ Vote | Private Equity’s Hidden Fees | A Wrap-Up of ‘Woodstock for Capitalists’,"BRITAIN’S CONSERVATIVES GET HEDGE FUNDS’ VOTE | The British elections are on Thursday, and members of one constituency, the financiers, have already made their preference extremely clear, Danny Hakim writes in DealBook. Britain’s Conservative-led government has been a staunch supporter of hedge funds and banks, battling at home and in the European Union on their behalf, and some hedge fund managers have written “eye-popping checks” to the party. More than $2.3 million came from Michael Hintze, an Australian billionaire who lives in London, where he founded the hedge fund CQS; Michael Farmer, another hedge fund manager, has donated roughly $2.2 million over the same reporting period; and Stanley Fink, who once ran the Man Group and has been party treasurer, has donated $1.3 million since the 2010 election. ",https://news.blogs.nytimes.com/2015/05/04/morning-agenda-britains-conservatives-get-hedge-funds-vote/
872,2015-05-01 16:06:29+00:00,Bitcoin Comes Out of the Shadows and Into Wall Street’s Sights,Why Goldman’s investment in a Bitcoin start-up is a sign of a pivotal change.,At the end of a panel discussion at the Inside Bitcoins conference in New York this week – billed as the largest such event in the world – a supporter of the cryptocurrency pointed to one of the three lawyers discussing Bitcoin’s struggle for mainstream acceptance.,https://www.nytimes.com/2015/05/02/business/dealbook/bitcoin-comes-out-of-the-shadows-and-into-wall-streets-sights.html
873,2015-04-30 11:14:48+00:00,Morning Agenda: Salesforce Said to be Preparing for Takeover Offers,Salesforce Said to be Preparing for Takeover Offers | Goldman Sachs Backs Bitcoin Company | Programmer’s Trial Resumes After 2 Jurors Removed | Secret Shutting Down,"SALESFORCE SAID TO BE PREPARING FOR TAKEOVER OFFERS  | Who wants to buy Salesforce.com? That was the big question Wednesday following a report by Bloomberg News that the cloud software giant had hired financial advisers to field takeover inquiries after it was approached by a potential buyer. Unidentified people with knowledge of the matter told Bloomberg News that it was not certain that any deal would be struck, and they didn’t name any possible buyers. ",https://news.blogs.nytimes.com/2015/04/30/morning-agenda-salesforce-said-to-be-preparing-for-takeover-offers/
874,2015-04-30 11:00:08+00:00,In Code We Trust,Technology has upended our economy. Can technology save it?,"When Caesar Augustus minted the denarius coin, around 4 A.D., he did so with a decree that it be made almost entirely of silver. But over the coming decades, as the financial health of the Roman Empire declined — largely because of its increasingly independent army, which demanded ever more money to subdue the rebellious provinces — the emperors began, slowly at first, mixing in copper to stretch the silver further. By 280 A.D., a denarius was 98 percent copper, with a thin silver wash on the surface. The implication was clear to every Roman: Here, in their hands, was a physical manifestation of the empire’s deepening desperation. Whatever proclamations the emperor might make, the coin told the truth.",https://www.nytimes.com/2015/05/03/magazine/in-code-we-trust.html
875,2015-04-30 04:01:18+00:00,Goldman and IDG Put $50 Million to Work in a Bitcoin Company ,"Despite fading interest from the public, Wall Street has been quietly looking at the virtual currency, which can be sent securely, cheaply and almost instantly around the world.","Goldman Sachs is becoming the first major bank to make a significant investment in a Bitcoin-focused company, giving a vote of confidence to the embattled virtual currency.",https://www.nytimes.com/2015/04/30/business/dealbook/goldman-and-idg-put-50-million-to-work-in-a-bitcoin-company.html
876,2015-04-29 11:03:28+00:00,Want a Steady Income? There’s an App for That,A Silicon Valley start-up wants to put workers on an even keel.,"Heather Jacobs, a chain-­spa masseuse in Simi Valley, Calif., never knows how much money is coming her way. When her spa charges $99 for a 55-­minute massage, she makes $18. But if she books just two massages in a six-­hour workday, the spa must raise her day’s pay to minimum wage, which is $9 an hour. Jacobs, who is 28, can’t be sure how many hours she will get or how many walk-­ins will choose her — a 5-foot-­2, 96-­pound masseuse who looks as if she could manage only a 1 on the four-­point pressure scale, though she is really a 3, verging on a 4. Her paychecks, which come every two weeks, have been as high as $700 and as low as $90. She also freelances for a gym, offering passers-­by free massages on the chance they might join; the gym doesn’t pay her, so for that she earns only tips. She seeks out private clients too, especially around the 27th of the month, when her credit-­card bill, with its $90 minimum payment, is due.",https://www.nytimes.com/2015/05/03/magazine/want-a-steady-income-theres-an-app-for-that.html
877,2015-04-29 11:03:21+00:00,Can Bitcoin Conquer Argentina?,"With its volatile currency and dysfunctional banks, the country is the perfect place to experiment with a new digital currency.","Dante Castiglione stalked through the doors of a glass-walled office tower on the edge of downtown Buenos Aires, just a few hundred feet from the old port district. In the crowded elevator, he shook his head and muttered under his breath about the stresses of the day and his profession. “I swear, this job can kill me,” he said, his eyes cast downward.",https://www.nytimes.com/2015/05/03/magazine/how-bitcoin-is-disrupting-argentinas-economy.html
878,2015-04-16 21:08:23+00:00,Reading The Times With Andy Borowitz,"The political satirist Andy Borowitz reads The New York Times on April 16, 2015.","Andy Borowitz is the creator of the news satire column The Borowitz Report and a memoir, “An Unexpected Twist.” ",https://www.nytimes.com/times-insider/2015/04/16/reading-the-times-with-andy-borowitz/
879,2015-04-14 11:00:24+00:00,The Muddied Meaning of ‘Mindfulness’,"If the word seems like a badge for the self-satisfied set, that’s because its true meaning has become obscured.","Most newly stylish coinages carry with them some evidence of grammatical trauma. Consider “affluencer,” “selfie,” “impactful.” Notes of cynicism and cutesiness come through. But every now and then a bright exception to this dispiriting routine appears. A rookie word makes its big-league debut, a stadium of pedants prepares to peg it with tomatoes and — nothing. A halfhearted heckle. The new word looks only passably pathetic. Maddeningly, it has heft.",https://www.nytimes.com/2015/04/19/magazine/the-muddied-meaning-of-mindfulness.html
880,2015-04-10 11:03:19+00:00,Today in Politics: Guns Give Republicans a Reprieve From Discord,Republican candidates and potential candidates will have plenty to agree with at the annual National Rifle Association leadership conference.,"Good Friday morning from Washington. Former Gov. Lincoln Chafee of Rhode Island says he’s considering running for president, and Senator Tim Kaine of Virginia sees Lee’s surrender to Grant as a model for national grace. President Obama continues his trip to Panama, by way of Jamaica and Bob Marley‘s house, and the friendship between Senator Marco Rubio of Florida and Jeb Bush, the state’s former governor, may be tested in a Republican primary. In Tennessee, however, the Republican candidates and potential candidates will have plenty to agree with at the annual National Rifle Association leadership conference.",https://www.nytimes.com/politics/first-draft/2015/04/10/today-in-politics-guns-give-republicans-a-reprieve-from-discord/
881,2015-04-10 00:09:02+00:00,"SendGrid Account Breach Was Used to Attack Coinbase, a Bitcoin Exchange","Coinbase, one of the most popular Bitcoin exchanges, confirmed that hackers had compromised its SendGrid account, though it said no Bitcoin were stolen.","SAN FRANCISCO — Hackers targeted SendGrid, a mass email service used by 180,000 companies including Uber, Pinterest, Spotify and Foursquare, to infiltrate Coinbase, one of the most popular Bitcoin exchanges.",https://bits.blogs.nytimes.com/2015/04/09/sendgrid-email-breach-was-used-to-attack-coinbase-a-bitcoin-exchange/
882,2015-04-09 16:15:53+00:00,"In Accepting Bitcoin, Rand Paul Raises Money and Questions",Some say the virtual currency will one day be a part of all presidential campaigns. But its untraceable nature stirs concerns of illegal contributions.,"WASHINGTON — Presidential fund-raising, never known for its transparency, may have just become even more secretive.",https://www.nytimes.com/2015/04/10/us/politics/in-accepting-bitcoin-rand-paul-raises-money-and-questions.html
883,2015-04-08 11:04:16+00:00,Today in Politics: Obama’s Trip to Panama Includes a Cuban Subplot,President Obama begins a trip to Panama where he may or may not have a much-watched meeting with President Raúl Castro of Cuba.,"Good Wednesday morning from Washington, where a short-lived power failure briefly shut down the government. Mayor Rahm Emanuel of Chicago gets to keep his job after a runoff, while Secretary of State John Kerry will meet with Jewish leaders to try and ease their concerns over a possible nuclear agreement with Iran. Representative Charles B. Rangel has recipe suggestions, and Senator Rand Paul of Kentucky hit the ground running after announcing his candidacy. President Obama begins a trip to Panama where he may or may not have a much-watched meeting with President Raúl Castro of Cuba.",https://www.nytimes.com/politics/first-draft/2015/04/08/today-in-politics-obamas-trip-to-panama-includes-a-cuban-subplot/
884,2015-04-01 13:44:59+00:00,Wall Street and Silicon Valley Form an Uneasy Alliance,"Entrepreneurs and venture capitalists have done their best to resist or reduce Wall Street’s entreaties, but it appears that a new relationship has begun to develop.",Silicon Valley has always had an uneasy relationship with Wall Street.,https://www.nytimes.com/2015/04/02/business/dealbook/wall-street-and-silicon-valley-form-an-uneasy-alliance.html
885,2015-04-01 13:34:28+00:00,Silicon Valley Bank Strengthens Its Roots,Silicon Valley Bank has maintained a competitive edge among start-ups and venture capitalists by understanding the local culture — jeans and all.,"While Wall Street banks scramble to stake claims in the booming technology industry, they are finding a smaller one already firmly entrenched.",https://www.nytimes.com/2015/04/02/business/dealbook/silicon-valley-bank-strengthens-its-roots.html
886,2015-03-31 20:04:18+00:00,"Investing Early On for Insights, Not Profits","BBVA, the global Spanish bank, has established a venture capital fund in Silicon Valley that is more interested in fruitful partnerships than profits.",SAN FRANCISCO — The small office on the edge of the financial district here serves as a kind of listening post for a giant Spanish bank.,https://www.nytimes.com/2015/04/02/business/dealbook/investing-early-on-for-insights-not-profits.html
887,2015-03-30 15:47:10+00:00,"Inquiry of Silk Road Website Spurred Agents’ Own Illegal Acts, Officials Say","The agents, one with the Drug Enforcement Administration and one with the Secret Service, have been charged with money laundering and wire fraud.","On the so-called dark web, drug dealing and other illicit sales have thrived in recent years, the authorities have said, through hidden websites like Silk Road and hard-to-trace digital currencies like Bitcoins.",https://www.nytimes.com/2015/03/31/nyregion/silk-road-case-federal-agents-charges.html
888,2015-03-21 18:30:14+00:00,"What’s New, Pussycat? Meerkat!","South by Southwest is obsessed with cats, from Grumpy Cat to Meerkat, but what if the masters of detachment could talk back to an Internet focused on attachment?","AUSTIN, Tex. — PITY the poor cat.",https://www.nytimes.com/2015/03/22/opinion/sunday/maureen-dowd-whats-new-pussycat-meerkat.html
889,2015-03-18 19:13:23+00:00,"Crowdfunded Entrepreneurs, Tripped Up by the Taxman",Campaigns on sites like Kickstarter can help a small business get started. But the complex income and sales tax reckoning can come as a surprise.,"Jenny Wecker, a fledgling Salt Lake City entrepreneur, had a hit on her hands at the end of December: She collected $42,000 in pledges from the crowdfunding site Kickstarter for more than 300 orders of a stylish diaper bag she had designed.",https://www.nytimes.com/2015/03/19/business/crowdfunded-entrepreneurs-tripped-up-by-the-taxman.html
890,2015-03-18 09:30:10+00:00,"‘The Age of Cryptocurrency,’ by Paul Vigna and Michael J. Casey",A look at the rapidly evolving world of digital money.,"Money, “The Age of Cryptocurrency” ­explains, is “a medium of exchange, a unit of account and a store of value.” But for Schopenhauer it was “human happiness in the abstract,” and for Dostoyevsky “coined liberty.” These passion metaphors reflect the febrile excitement about Bitcoin that Paul Vigna and Michael J. Casey, both of The Wall Street Journal, share in their wide-ranging, interesting account of the origin, past and possible future of this virtual-money wannabe.",https://www.nytimes.com/2015/03/22/books/review/the-age-of-cryptocurrency-by-paul-vigna-and-michael-j-casey.html
891,2015-03-17 09:45:08+00:00,Your Tuesday Briefing,Here’s what you need to know to start your day.,(Want to get the Morning Briefing in your inbox first thing? Sign up.),https://www.nytimes.com/2015/03/17/nytnow/latest-news-israeli-elections-ncaa-basketball-art-theft-anniversary.html
892,2015-03-13 09:42:45+00:00,Your Friday Briefing,Here’s what you need to know to start your day.,Good morning.,https://www.nytimes.com/2015/03/13/nytnow/latest-news-ferguson-manhunt-hillary-clinton-emails-a-patent-for-earmuffs.html
893,2015-03-12 11:28:24+00:00,Morning Agenda: U.S. Banks Pass Fed Tests,All the large U.S. banks pass the Fed’s stress tests. | The Utah Legislature approves a white-collar felon registry. | Endo tops Valeant’s offer for Salix. | Alibaba plans to invest in Snapchat.,"U.S. BANKS PASS FED EXAM | The Federal Reserve said on Wednesday that all the large United States banks passed its so-called stress tests, which aim to assess whether they can weather a financial storm, DealBook’s Peter Eavis writes. Bank of America passed only provisionally and could still fail later this year if it does not fix deficiencies that the Fed identified. Goldman Sachs, JPMorgan Chase and Morgan Stanley each had to alter their planned payouts to investors to achieve passing grades. The American units of Deutsche Bank, the German banking giant, and Santander of Spain failed the tests outright. ",https://news.blogs.nytimes.com/2015/03/12/morning-agenda-u-s-banks-pass-fed-tests/
894,2015-03-11 17:07:44+00:00,Former JPMorgan Executive Blythe Masters Joins Bitcoin-Related Start-Up,"Ms. Masters, who once headed JPMorgan Chase’s commodities unit, is joining Digital Asset Holdings, a firm seeking to streamline financial transactions.",A prominent former executive at JPMorgan Chase has left the world of commodity trading for the virtual world of digital transactions.,https://www.nytimes.com/2015/03/12/business/dealbook/former-jpmorgan-executive-blythe-masters-joins-bitcoin-related-start-up.html
895,2015-03-11 11:05:44+00:00,Morning Agenda: Citigroup’s Resurgence,Citigroup’s traders and investment bankers have come roaring back since the financial crisis. | Credit Suisse gets a risk expert in new chief. | Emerging markets are losing their luster. | Former JPMorgan executive joins a Bitcoin start-up.,"CITIGROUP’S RESURGENCE | Seven years after Citigroup teetered on the brink, the bank’s traders and investment bankers have come roaring back, Peter Eavis writes in DealBook. The bank’s resurgence on Wall Street, which has involved acquiring huge amounts of derivatives, comes as many of its rivals pull back in the face of new regulations intended to make the financial system safer. But even as the bank has surged ahead, it has not trumpeted its comeback. Instead, its most senior executives have largely emphasized streamlining operations that have little to do with Wall Street, like agreeing to sell a unit that focuses on subprime loans.",https://news.blogs.nytimes.com/2015/03/11/morning-agenda-citigroups-resurgence/
896,2015-03-06 12:31:18+00:00,Morning Agenda: Big Banks Pass Stress Tests,"The nation’s biggest banks pass the Fed’s latest stress tests. | AbbVie goes on the defensive after deal for cancer drug maker. | Bidders show interest in the government’s third Bitcoin auction. | Nasdaq’s long climb back to 5,000.","BIG BANKS PASS STRESS TESTS | All 31 of the nation’s biggest banks appear to have enough financial strength to survive a severe downturn in the United States economy, according to the results of the so-called stress tests that the Federal Reserve released on Thursday. But some banks fared better than others, DealBook’s Peter Eavis writes.",https://news.blogs.nytimes.com/2015/03/06/morning-agenda-big-banks-pass-stress-tests/
897,2015-03-05 22:33:50+00:00,U.S. Auction Suggests Lingering Interest in Bitcoin,"The United States Marshals Service said that 14 bidders took part in an auction on Thursday for 50,000 Bitcoins, worth around $14 million.",The falling price of Bitcoin has not entirely quashed investor enthusiasm for the virtual currency.,https://www.nytimes.com/2015/03/06/business/dealbook/us-auction-suggests-lingering-interest-in-bitcoin.html
898,2015-03-02 12:31:56+00:00,Morning Agenda: Buffett Hints at Successor,Warren E. Buffett hinted at a successor in his annual letter to shareholders. | Wells Fargo puts a cap on subprime auto loans. | Semiconductor giants agree to merger. | A former Tyco chief’s path to obscurity. | Bitcoin’s true value may lie in its underlying technology.,"BUFFETT HINTS AT SUCCESSOR | Warren E. Buffett released his annual letter to shareholders on Saturday, reflecting on his 50 years in control of Berkshire Hathaway, one of the world’s biggest companies. In his 24,000-word letter to commemorate his golden anniversary at the company, Mr. Buffett looked back on less prescient moves. He also railed against investment bankers, accusing them of being nearsighted and self-serving.",https://news.blogs.nytimes.com/2015/03/02/morning-agenda-buffett-hints-at-successor/
899,2015-03-02 00:49:05+00:00,Data Security Is Becoming the Sparkle in Bitcoin,"With the price of Bitcoin plummeting, the technology that stores the currency’s transactions is gaining value as a safe and open way to keep other kinds of records.","Some couples opt for a traditional wedding, while others go for the Elvis impersonator in Las Vegas. But David Mondrus and Joyce Bayo may be the first to have incorporated Bitcoin.",https://www.nytimes.com/2015/03/02/business/dealbook/data-security-is-becoming-the-sparkle-in-bitcoin.html
900,2015-02-19 12:36:02+00:00,Morning Agenda: Britain to Examine Competition in Banking,A British regulator is planning to review competition in investment banking. | Greece requests an extension to its loan agreement. | Two deals put the spotlight on a secretive banking family. | Uber expands its financing round.,"BRITAIN TO EXAMINE COMPETITION IN BANKING | The Financial Conduct Authority of Britain said on Thursday that it planned to review whether competition was working properly in the corporate and investment banking sectors, DealBook’s Chad Bray reports. The regulator conducted a similar review of so-called wholesale securities and investment markets last year, and plans to consider looking at the asset management sector this year.",https://dealbook.nytimes.com/2015/02/19/morning-agenda-britain-to-examine-competition-in-banking/
