,date,headline,abstract,lead_paragraph,url
450,2018-01-08 12:40:07+00:00,"With Apple, the Tech Reckoning Gains Momentum: DealBook Briefing",The push by two investors to have Apple give parents better controls over their children’s iPhones highlights the increasing backlash against tech companies.,Good Monday. Here’s what we’re watching:,https://www.nytimes.com/2018/01/08/business/dealbook/intel-ceo-security.html
451,2018-01-07 19:02:26+00:00,"North Korea, Jerusalem, Golden Globes: Your Monday Briefing",Here’s what you need to know to start your day.,Good morning. ,https://www.nytimes.com/2018/01/07/briefing/north-korea-jerusalem-golden-globes.html
452,2018-01-05 16:54:50+00:00,Should You Buy Bitcoin? Ask a Different Question First,"Before chasing Bitcoin or some other shiny thing, ask yourself this first: What are my financial goals? And does speculating fit within those goals?",I received these two messages within three minutes of each other recently:,https://www.nytimes.com/2018/01/05/your-money/bitcoin-investing.html
453,2018-01-05 14:02:20+00:00,Comedy in NYC This Week,"Our guide to stand-up, improv and variety shows.","Our guide to stand-up, improv and variety shows.",https://www.nytimes.com/2018/01/05/arts/comedy-in-nyc-this-week.html
454,2018-01-05 00:34:45+00:00,Rise of Bitcoin Competitor Ripple Creates Wealth to Rival Zuckerberg,"A co-founder of Ripple, a virtual currency, could briefly lay claim to being the world’s fifth richest person on Thursday, bypassing Mark Zuckerberg, as the Bitcoin boom widened.",SAN FRANCISCO — The virtual currency boom has gotten so heated that it is throwing the list of the world’s richest people into disarray.,https://www.nytimes.com/2018/01/04/technology/bitcoin-ripple.html
455,2018-01-04 21:02:31+00:00,"After Dow 25,000, the Party Has to End. But When?","Market veterans say that stocks are overvalued and that a downturn is overdue. The question is how messy it will be, and how investors should prepare.","In the midst of a long-running bull market that is now reaching momentous proportions, most investors may well have forgotten that just two years ago, during the first five trading days of 2016, the market dropped 6 percent. It was the worst five-day start to a year ever and supposedly a harbinger of bad times.",https://www.nytimes.com/2018/01/04/business/market-dow-2018.html
456,2018-01-04 12:27:22+00:00,Trump Moves to Greatly Expand Offshore Drilling: DealBook Briefing,"The Trump administration will allow new offshore oil and gas drilling in nearly all United States waters, a move likely welcomed by the energy industry.",Good Thursday. (We hope that all U.S.-based readers are staying warm.) Here’s what we’re watching:,https://www.nytimes.com/2018/01/04/business/dealbook/trump-bannon-wolff-book.html
457,2018-01-04 01:42:31+00:00,Central Florida Claims a National Title. Want to Fight About It?,"The 13-0 Central Florida Knights, the only undefeated top-tier college football team, aren’t in the national championship game. But they’re still calling themselves champs.","It started New Year’s Day, right after No. 10 Central Florida defeated No. 7 Auburn in the Peach Bowl, 34-27, and improved to a perfect 13-0.",https://www.nytimes.com/2018/01/03/sports/central-florida-claims-a-national-title-want-to-fight-about-it.html
458,2018-01-03 23:13:33+00:00,"Stephen Bannon, Nuclear Button, Iran: Your Wednesday Evening Briefing",Here’s what you need to know at the end of the day.,(Want to get this briefing by email? Here’s the sign-up.),https://www.nytimes.com/2018/01/03/briefing/stephen-bannon-nuclear-button-iran.html
459,2018-01-03 22:10:24+00:00,"From Bitcoin to Russia Investigation, a Look Ahead at 2018","With a little trepidation, Peter J. Henning offers up his thoughts on a few topics that should continue to be of interest in 2018.","From the surging value of cryptocurrencies to the continuing investigation of Russian interference in the 2016 presidential election, developments in 2017 were hard to forecast. Who could have predicted that an article in The New York Times in October describing sexual misconduct by the movie mogul Harvey Weinstein would unleash a torrent of claims about media stars, members of Congress and the judiciary and even an N.F.L. owner?",https://www.nytimes.com/2018/01/03/business/dealbook/bitcoin-russia-investigation.html
460,2018-01-03 20:47:23+00:00,Russia and Venezuela’s Plan to Sidestep Sanctions: Virtual Currencies,Both countries have floated plans to create homegrown virtual currencies that would put them outside the global financial and banking system.,SAN FRANCISCO — Russian and Venezuelan officials are hoping virtual currencies can help their countries make an end run around American sanctions.,https://www.nytimes.com/2018/01/03/technology/russia-venezuela-virtual-currencies.html
461,2018-01-03 11:47:48+00:00,Tesla Pushes Back Its Model 3 Targets Again: DealBook Briefing,The electric carmaker pushed back production targets for its Model 3 for the second time.,Good Wednesday. Here’s what we’re watching:,https://www.nytimes.com/2018/01/03/business/dealbook/ant-financial-moneygram-trump.html
462,2018-01-03 10:00:31+00:00,"Expect 2018 to Be More Sane? Sorry, It’s Not Going to Happen","Instead of revealing unseen order and predictability in the world, technology has made the world more volatile.","Happy new year to you and yours, of course, but I’m going to have to put a halt to the festivities and play Frowning Farhad for a minute: You’re fooling yourself if you think 2018 is going to be any different, sanity- or anxiety-wise, from the roller coaster of the year just concluded.",https://www.nytimes.com/2018/01/03/technology/2018-technology-chaos.html
463,2018-01-02 12:55:41+00:00,Peter Thiel Is a Bitcoin Believer: DealBook Briefing,The value of the digital currency jumped this afternoon after Mr. Thiel’s Founders Fund venture firm emerged as an investor.,Good Tuesday and happy new year!,https://www.nytimes.com/2018/01/02/business/dealbook/2018-business-trump.html
464,2018-01-02 01:18:04+00:00,Toasts to the Deals (and Other Winners) of 2017,"The last year gave us some whopping deals, including Amazon.com’s acquisition of Whole Foods, that will shape the business landscape in 2018.",Please take your seats.,https://www.nytimes.com/2018/01/01/business/dealbook/biggest-deals-2017.html
465,2018-01-01 21:26:33+00:00,Can the Economy Keep Calm and Carry On?,"Normally, presidents don’t matter much. But our normality is fragile.","On election night 2016, I gave in temporarily to a temptation I warn others about: I let my political feelings distort my economic judgment. A very bad man had just won the Electoral College; and my first thought was that this would translate quickly into a bad economy. I quickly retracted the claim, and issued a mea culpa. (Being an old-fashioned guy, I try to admit and learn from my mistakes.)",https://www.nytimes.com/2018/01/01/opinion/can-the-economy-keep-calm-and-carry-on.html
466,2017-12-30 10:30:15+00:00,10 of Our Best Weekend Reads + One Great Video,"The magazine looks back at artists, innovators and thinkers we lost this year. Styles offers a lesson in cryptokitties (I had to Google it, too). And Metropolitan offers lessons in happiness from those who have lots of experience.","This weekend is one for reflecting and looking ahead; for family, friends and football; for sleeping in and starting things off right; for bundling up and bingeing on good (or bad) TV. Whatever you’re doing, take a minute, or a bit more, and indulge in some great journalism. Happy New Year!",https://www.nytimes.com/2017/12/30/arts/10-of-our-best-weekend-reads-one-great-video.html
467,2017-12-28 20:20:46+00:00,"CryptoKitties, Explained ... Mostly","Why are $20 million and 180,000 people suddenly in the market for digital cats? We gamified the blockchain.","SAN FRANCISCO — Joe Buttram, a former mixed martial arts fighter and start-up security guard turned cryptocurrency investor, was looking at a new toy called a CryptoKitty.",https://www.nytimes.com/2017/12/28/style/cryptokitties-want-a-blockchain-snuggle.html
468,2017-12-28 19:00:17+00:00,"Kabul, Roy Moore, Bitcoin: Your Friday Briefing",Here’s what you need to know to start your day.,Good morning. ,https://www.nytimes.com/2017/12/28/briefing/kabul-roy-moore-bitcoin.html
469,2017-12-28 11:42:51+00:00,South Korea Clamps Down on Bitcoin Trading Amid Market Frenzy,"In one of the biggest hubs for virtual currencies, the government said it would no longer let people buy or sell Bitcoin or its rivals anonymously.","South Korea will require people who trade Bitcoin and other virtual currencies to do so under their real names, the country’s government said on Thursday, as part of efforts to curb speculation.",https://www.nytimes.com/2017/12/28/business/south-korea-bitcoin.html
470,2017-12-27 23:50:36+00:00,"Some Things About Tech Were Good in 2017. No, Really.","Amid a series of scandals and sins, a few righteous tech innovators actually brought positive change this year.","For much of Silicon Valley, 2017 felt like a nonstop parade of scandal and sin.",https://www.nytimes.com/2017/12/27/technology/tech-roundup-2017.html
471,2017-12-27 15:31:21+00:00,"A World of Deal Making, Gleaned With an iPhone X","Michael de la Merced, a DealBook reporter in London, discussed his favorite tech tool — an iPhone X — and British norms for using the gadget socially.","How do New York Times journalists use technology in their jobs and in their personal lives? Michael de la Merced, a DealBook reporter for The Times based in London, discussed the tech he is using.",https://www.nytimes.com/2017/12/27/technology/personaltech/dealmaking-london-iphone-x.html
472,2017-12-25 19:02:47+00:00,"Pope Francis, North Korea, Jerusalem: Your Tuesday Briefing",Here’s what you need to know to start your day.,Good morning. ,https://www.nytimes.com/2017/12/25/briefing/pope-francis-north-korea-jerusalem.html
473,2017-12-22 23:51:59+00:00,Tax Bill Hysteria,Opposition to the bill is a gift to the G.O.P.,"In case you haven’t heard, nearly all that’s good and pleasant in the world died this week. The tax bill passed.",https://www.nytimes.com/2017/12/22/opinion/republican-tax-bill-hysteria.html
474,2017-12-22 15:12:45+00:00,Bitcoin Plummets More Than 30 Percent in Less Than a Day,"Just days after the price of Bitcoin nearly reached $20,000, the virtual currency was hit by a panicked sell-off. Reddit users posted suicide hotlines.","You can’t exactly say that Bitcoin was burning a hole in anyone’s pocket, but the virtual currency burned a hole in quite a few hearts on Friday when it plunged 30 percent in less than 24 hours after defying gravity for the past few months.",https://www.nytimes.com/2017/12/22/business/bitcoin-plunges-more-than-25-percent-in-24-hours.html
475,2017-12-22 14:00:01+00:00,Farhad and Mike’s Week in Tech: Cuckoo for Cryptocurrency,Two Times technology reporters discuss the goings-on of Silicon Valley and beyond. This week: more Bitcoin and Uber’s problems (again).,"Each Friday, Farhad Manjoo and Mike Isaac, technology reporters at The New York Times, review the week’s news, offering analysis and maybe a joke or two about the most important developments in the tech industry. Want this newsletter in your inbox? Sign up here.",https://www.nytimes.com/2017/12/22/technology/farhad-mike-cryptocurrency-uber.html
476,2017-12-22 12:18:28+00:00,One of Bitcoin’s Biggest Champions Turns Bearish: DealBook Briefing,"Michael Novogratz, the former Fortress executive, told Bloomberg that he was shelving plans for a cryptocurrency hedge fund and said bitcoin will fall to $8,000.", Good Friday. Here’s what we’re watching:,https://www.nytimes.com/2017/12/22/business/dealbook/bitcoin-fall-blockchain.html
477,2017-12-22 05:03:44+00:00,"Catalonia, Jerusalem, Christmas: Your Friday Briefing",Here’s what you need to know to start your day.,(Want to get this briefing by email? Here’s the sign-up.),https://www.nytimes.com/2017/12/22/briefing/catalonia-jerusalem-christmas.html
478,2017-12-21 22:51:02+00:00,The Can’t-Lose Way for Your Business to Pop: Add Bitcoin to Its Name,"Businesses previously focused on making fitness apparel, cigars and beverages have rebranded themselves into virtual currency or blockchain companies.",It’s clear that a business idea is hot when companies that have nothing to do with the idea get involved.,https://www.nytimes.com/2017/12/21/technology/bitcoin-blockchain-stock-market.html
479,2017-12-21 19:22:35+00:00,Get Me to a Nunnery,A Christmastime longing for life at an abbey.,"Three years ago this week, I was a guest at a cloistered Catholic abbey in rural Connecticut. I spent my days in near-silence, waking before dawn for Mass, working the farm alongside nuns in full habit. When bells rang at regular intervals, all work ceased so that the nuns could chant in Latin.",https://www.nytimes.com/2017/12/21/opinion/sunday/christmas-nuns-abbey.html
480,2017-12-21 12:41:19+00:00,"Eric Schmidt, Alphabet’s ‘Ambassador,’ to Step Down: DealBook Briefing",Eric Schmidt is stepping down as executive chairman of Google-parent Alphabet., Good Thursday. Here’s what we’re watching:,https://www.nytimes.com/2017/12/21/business/dealbook/taxes-workers-att.html
481,2017-12-20 23:10:28+00:00,"Republican Party, Jerusalem, Uber: Your Wednesday Evening Briefing",Here’s what you need to know at the end of the day.,(Want to get this briefing by email? Here’s the sign-up.),https://www.nytimes.com/2017/12/20/briefing/republican-party-jerusalem-uber.html
482,2017-12-20 19:02:13+00:00,"Republican Party, European Union, Solstice: Your Thursday Briefing",Here’s what you need to know to start your day.,Good morning. ,https://www.nytimes.com/2017/12/20/briefing/republican-party-european-union-solstice.html
483,2017-12-20 16:05:42+00:00,A New Russian Ploy: Competing Extradition Requests,Moscow is seeking to block U.S. trials of cybercriminals by trying to extradite them to Russia for crimes allegedly committed years before.,"MOSCOW — The Russian spam kingpin had long been in the cross hairs of the F.B.I., and agents finally got their shot when the man scheduled a vacation in Spain. At the agency’s request, Spanish security officers in April arrested the man, Pyotr Y. Levashov, who is accused of stuffing untold millions of inboxes with ads for pornography, pills and penny stocks.",https://www.nytimes.com/2017/12/20/world/europe/russia-extradition-levashov.html
484,2017-12-20 12:17:56+00:00,It’s a Merry ‘Taxmas’ for AT&T Employees: DealBook Briefing,"AT&T said it will pay a $1,000 bonus to more than 200,000 employees and would increase its capital expenditure budget for next year by $1 billion.", Good Wednesday. Here’s what we’re watching:,https://www.nytimes.com/2017/12/20/business/dealbook/uber-european-court.html
485,2017-12-20 10:26:44+00:00,"Republican Party, Uber, Bernard Law: Your Wednesday Briefing",Here’s what you need to know to start your day., (Want to get this briefing by email? Here’s the sign-up.),https://www.nytimes.com/2017/12/20/briefing/republican-party-bernard-law-virginia.html
486,2017-12-20 05:03:13+00:00,"Tax Bill, Saudi Arabia, Angela Merkel: Your Wednesday Briefing",Here’s what you need to know to start your day.,(Want to get this briefing by email? Here’s the sign-up.),https://www.nytimes.com/2017/12/20/briefing/tax-bill-saudi-arabia-angela-merkel.html
487,2017-12-19 19:05:37+00:00,"North Korea, Yemen, Derailment: Your Wednesday Briefing",Here’s what you need to know to start your day.,Good morning. ,https://www.nytimes.com/2017/12/19/briefing/north-korea-yemen-derailment.html
488,2017-12-19 18:16:52+00:00,How the Winklevoss Twins Found Vindication in a Bitcoin Fortune,The virtual currency stockpile that Cameron and Tyler Winklevoss began amassing in 2012 is now worth around $1.65 billion. They have no plans to sell.,The Winklevoss twins have carved an unorthodox path toward fame in the American business world.,https://www.nytimes.com/2017/12/19/technology/bitcoin-winklevoss-twins.html
489,2017-12-19 11:41:00+00:00,The Winklevoss Twins’ Path to Bitcoin Fortune: DealBook Briefing,Cameron and Tyler Winklevoss made a risky bet five years ago: They loaded up on Bitcoin. That stockpile is now worth around $1.3 billion.,Good Tuesday morning. Here’s what we’re watching:,https://www.nytimes.com/2017/12/19/business/dealbook/bitcoin-hedge-fund.html
490,2017-12-19 10:00:21+00:00,"A Bitcoin Hedge Fund’s Return: 25,004% (That Wasn’t a Typo)","The Pantera Bitcoin Fund was set up in 2013, when few on Wall Street were interested in cryptocurrencies. It has since ridden the Bitcoin wave to blockbuster returns.",SAN FRANCISCO — There are hedge funds with blockbuster returns. Then there is the Pantera Bitcoin Fund.,https://www.nytimes.com/2017/12/19/technology/bitcoin-hedge-fund.html
491,2017-12-19 00:06:20+00:00,The Bitcoin Boom: In Code We Trust,"Bitcoin may be in a bubble, but it is part of a much bigger trend that is here to stay: a shift in trust from government to technology.","You don’t need brilliant financial analysis skills to notice that Bitcoin is in a bubble. It has grown in value from about 39 cents to over $18,000 in just eight years and recently attracted broad media attention by doubling in just a few days. The conventional wisdom had been that illegal and illicit transactions — buying drugs or transferring money out of Argentina — accounted for much of Bitcoin’s value. Today the mainstream view sees mere greed and speculation.",https://www.nytimes.com/2017/12/18/opinion/bitcoin-boom-technology-trust.html
492,2017-12-18 19:17:34+00:00,"African National Congress, Amtrak, Donald Trump: Your Tuesday Briefing",Here’s what you need to know to start your day.,Good morning. ,https://www.nytimes.com/2017/12/18/briefing/african-national-congress-amtrak-donald-trump.html
493,2017-12-18 16:25:53+00:00,Casualties of the Cashless Society: Those Who Get Seasonal Tips,"Widespread use of Venmo, Uber et al mean less money in the pockets of Park Avenue doormen, manicurists and other workers.","As 2018 looms, the dawn of a cashless society feels at hand. Don’t believe it? Try throwing a couple $20 bills on the table next time you’re splitting the check. Or better yet, ask anyone not standing behind a cash register to break a $10 bill.",https://www.nytimes.com/2017/12/18/style/seasonal-tips-cash-free-payments.html
494,2017-12-18 11:00:17+00:00,"Cooking, and Reporting, in the Thrall of the Instant Pot",The $99 electric multicooker has hundreds of thousands of fans — including me.,"One of the perks of being a technology columnist is getting to test lots of gadgets before they’re available to the general public. As a result, my apartment has at times resembled a Best Buy showroom. I have installed Bluetooth door locks; Wi-Fi-connected lights that can be turned on and off by talking to my Amazon Echo; and a remote-controlled bidet on my toilet. (Don’t ask about that last one.)",https://www.nytimes.com/2017/12/18/insider/instant-pot-testing.html
495,2017-12-16 00:11:37+00:00,Why Some Tax Strategies Should Wait Until Next Year,"Although tempting opportunities might come to fruition in 2018, tax advisers suggest waiting until the consensus bill becomes law.","The Senate and the House closed in on a final version of the tax bill on Friday, as Republican leaders stay on track for final votes on the consensus bill next week.",https://www.nytimes.com/2017/12/15/your-money/tax-strategy-wealth.html
496,2017-12-15 14:00:02+00:00,Farhad and Mike’s Week in Tech: Net Neutrality Is Gone,"Our reporters look at the week in tech, including the F.C.C.’s decision to repeal net neutrality and Bitcoin’s continued boom.","Each week, Farhad Manjoo and Mike Isaac, technology reporters at The New York Times, review the week’s news, offering analysis and maybe a joke or two about the most important developments in the tech industry. Want this newsletter in your inbox? Sign up here.",https://www.nytimes.com/2017/12/15/technology/farhad-mikes-week-tech-net-neutrality.html
497,2017-12-15 12:00:27+00:00,What Is Bitcoin Really Worth? Don’t Even Ask.,"Bitcoin’s price is supported by the “animal spirits” of those betting on it, not by economic fundamentals. No wonder the market has been chaotic.",Dabbling in Bitcoin lies somewhere between gambling and investing.,https://www.nytimes.com/2017/12/15/business/bitcoin-investing.html
498,2017-12-14 17:54:59+00:00,A Totally Radical Plan for Getting Along With Your Siblings,And: rich neighbors choose fox-hunting over nature preservation; sharing the joy of DNA analysis; and swapping Secret Santa assignments.,"My sister and I (both in our 20s) have a tense relationship. She often misinterprets things I say as criticisms of her. My “Ready to go?” will be taken as a negative comment on the clothing or accessories she’s wearing. And frankly, her nonstop advice to me gets under my skin, too. I know there will come a day when we will get along peacefully as sisters. Until then, any ideas for keeping the meanness at bay?",https://www.nytimes.com/2017/12/14/style/getting-along-with-siblings.html
499,2017-12-14 12:24:17+00:00,Trump Congratulated Murdoch on the Disney Deal: DealBook Briefing,"While the Trump administration has moved to block one media deal, the president offered support to another — and said that it would be a “great thing” for jobs.",Good Thursday. Here’s what we’re watching:,https://www.nytimes.com/2017/12/14/business/dealbook/disney-fox-takeover.html
500,2017-12-14 05:03:51+00:00,"Brexit, Salma Hayek, Alabama: Your Thursday Briefing",Here’s what you need to know to start your day.,(Want to get this briefing by email? Here’s the sign-up.),https://www.nytimes.com/2017/12/14/briefing/brexit-salma-hayek-alabama.html
501,2017-12-13 19:11:23+00:00,"Alabama, Google, North Korea: Your Thursday Briefing",Here’s what you need to know to start your day.,Good morning. ,https://www.nytimes.com/2017/12/13/briefing/alabama-google-north-korea.html
502,2017-12-13 12:30:14+00:00,DealBook Briefing: Disney Deal Expected to Value Fox at Around $40 a Share,"Disney’s deal to buy film, television and international businesses from Rupert Murdoch’s Twenty-First Century Fox will value the latter at over $75 billion.",Good Wednesday. Here’s what we’re following today:,https://www.nytimes.com/2017/12/13/business/dealbook/alabama-senate-election.html
503,2017-12-13 10:34:11+00:00,"Doug Jones, Kirsten Gillibrand, ‘Star Wars’: Your Wednesday Briefing",Here’s what you need to know to start your day., (Want to get this briefing by email? Here’s the sign-up.),https://www.nytimes.com/2017/12/13/briefing/doug-jones-kirsten-gillibrand-star-wars.html
504,2017-12-13 05:11:16+00:00,"Alabama, Emmanuel Macron, Austria: Your Wednesday Briefing",Here’s what you need to know to start your day.,(Want to get this briefing by email? Here’s the sign-up.),https://www.nytimes.com/2017/12/13/briefing/alabama-macron-austria.html
505,2017-12-12 21:33:50+00:00,I Was Wrong About Bitcoin. Here’s Why.,"Our columnist predicted in 2013 that Bitcoin, then a new digital currency, would soon die. He points to five assumptions he got wrong.","Several years ago, tech enthusiasts in San Francisco began buzzing about a new and mysterious thing called Bitcoin. There were rumors that the virtual money, invented by a pseudonymous math genius named Satoshi Nakamoto, would revolutionize modern finance and render government-backed currency obsolete. Or maybe it was just a passing fad.",https://www.nytimes.com/2017/12/12/technology/bitcoin-predictions.html
506,2017-12-12 12:30:55+00:00,How Alabama’s Election Could Reshape Washington’s Policy Battles: DealBook Briefing,"Reducing Republicans’ majority in the Senate by just one seat may have big effects on debates about health care, infrastructure, taxes and more.",Good Tuesday. Here’s what we’re following today:,https://www.nytimes.com/2017/12/12/business/dealbook/alabama-senate-election.html
507,2017-12-11 22:17:55+00:00,Bitcoin Futures Set Scene for More Gambling,"Bitcoin futures open fresh avenues for trading, but for now the new contracts have little utility beyond speculation.","Bitcoin action is now available without the Bitcoin. The Chicago Board Options Exchange started offering futures on the cryptocurrency late on Sunday. The new contracts open fresh avenues for trading, but for now they have little utility beyond speculation.",https://www.nytimes.com/2017/12/11/business/dealbook/bitcoin-futures.html
508,2017-12-11 19:13:23+00:00,"New York City, North Korea, Jerusalem: Your Tuesday Briefing",Here’s what you need to know to start your day.,Good morning. ,https://www.nytimes.com/2017/12/11/briefing/new-york-city-north-korea-jerusalem.html
509,2017-12-11 12:30:24+00:00,Icahn Picks New Board Fight With Xerox: DealBook Briefing,The activist investor launched his second campaign to change the management of the copy-machine maker.,Good Monday morning. Here’s what we’re following today:,https://www.nytimes.com/2017/12/11/business/dealbook/bitcoin-futures-trading.html
510,2017-12-11 05:06:18+00:00,"Donald Trump, Laurent Wauquiez, Syria: Your Monday Briefing",Here’s what you need to know to start your day.,(Want to get this briefing by email? Here’s the sign-up.),https://www.nytimes.com/2017/12/11/briefing/donald-trump-laurent-wauquiez-syria.html
511,2017-12-10 19:01:30+00:00,"Jerusalem, Bitcoin, Nobel Peace Prize: Your Monday Briefing",Here’s what you need to know to start your day.,Good morning. ,https://www.nytimes.com/2017/12/10/briefing/jerusalem-bitcoin-nobel-peace-prize-your-monday-briefing.html
