,date,headline,abstract,lead_paragraph,url
1161,2014-03-26 13:01:11+00:00,Start-Up Unveils Bitcoin Payments Product,"The payment systems product from the start-up Circle Internet Financial allows consumers to deposit dollars into an account, which converts the money into Bitcoin and stores it remotely.","While some restaurants, bars and coffee shops accept the virtual currency Bitcoin, it still exists largely in the province of speculators. One start-up, Circle Internet Financial, is trying to push Bitcoin into mainstream commerce.",https://dealbook.nytimes.com/2014/03/26/start-up-unveils-bitcoin-payments-product-and-additional-financing/
1162,2014-03-26 12:45:12+00:00,Facebook’s $2 Billion Deal for Oculus,"Facebook to buy Oculus, a maker of a virtual reality headset. | A likely heir is leaving JPMorgan Chase. | The maker of Candy Crush is set to trade on the N.Y.S.E. | The Murdochs take a step in succession planning.","In a surprise move, Facebook announced on Tuesday that it had reached a $2 billion agreement to buy Oculus VR, the maker of a virtual reality headset, in a bet that technology commonly associated with science fiction can help eventually turn social networking into an immersive 3-D experience, Nick Wingfield and Vindu Goel write in The New York Times. The announcement comes just over a month after Facebook made waves by revealing it would buy the mobile messaging app WhatsApp for up to $19 billion.",https://dealbook.nytimes.com/2014/03/26/morning-agenda-facebooks-2-billion-deal-for-oculus/
1163,2014-03-26 12:11:30+00:00,Mt. Gox Seeks Advice From Japanese Police,"It is unclear whether the Tokyo police will start a formal investigation into Mt. Gox, the Bitcoin exchange that filed for bankruptcy last month.","TOKYO – Mt. Gox, the Bitcoin exchange based here that filed for bankruptcy protection last month, said on Wednesday that it had asked the Japanese police for advice on Bitcoins worth half a billion dollars that the company claims were stolen by hackers.",https://dealbook.nytimes.com/2014/03/26/mt-gox-seeks-advice-from-japanese-police/
1164,2014-03-25 22:42:56+00:00,Wall St. rallies as consumers perk up,Summary: A jump in consumer confidence to a six-year high helps Wall Street stop losing streak; new home sales fall again but old home prices rise; IRS says bitcoin should be taxed as property.  Conway G. Gittens reports.,Summary: A jump in consumer confidence to a six-year high helps Wall Street stop losing streak; new home sales fall again but old home prices rise; IRS says bitcoin should be taxed as property.  Conway G. Gittens reports.,https://www.nytimes.com/video/multimedia/100000002788118/wall-st-rallies-as-consumers-perk-up.html
1165,2014-03-25 18:59:47+00:00,I.R.S. Takes a Position on Bitcoin: It’s Property,Some financial experts view the move as a way to push Bitcoin away from the fringes and into the mainstream financial system.,"Updated, 8:53 p.m. | The Internal Revenue Service may have just taken some of the fun out of Bitcoin. But that may mean that the virtual currency is growing up.",https://dealbook.nytimes.com/2014/03/25/i-r-s-says-bitcoin-should-be-considered-property-not-currency/
1166,2014-03-24 17:08:57+00:00,Today in Small Business: From the Web to Bricks and Mortar,Getting people to read your emails. How G.M. is using social media to manage its reputation. Are you really as busy as you say you are?,"What’s affecting me, my clients and other small-business owners today.",https://boss.blogs.nytimes.com/2014/03/24/today-in-small-business-from-the-web-to-bricks-and-mortar/
1167,2014-03-24 12:55:59+00:00,A Top JPMorgan Banker Is Departing,One of JPMorgan’s top deal makers in China is retiring. | Herbalife is allowing Carl C. Icahn to nominate three more board representatives. | Regulatory changes have been slow to take hold at credit rating agencies. | Pimco has been attracting attention for the wrong reasons. | The Silk Road case began with a hunt for “John Doe.”,"Fang Fang, one of JPMorgan Chase’s top deal makers in China and a focus of the United States government’s investigation into the bank’s hiring practices in China, is resigning, Neil Gough writes in DealBook. Mr. Fang announced his decision in an internal memo sent to employees on Monday.",https://dealbook.nytimes.com/2014/03/24/morning-agenda-a-top-jpmorgan-banker-resigns/
1168,2014-03-21 20:15:30+00:00,Silk Road Case Began With Hunt for a John Doe,The criminal case against Ross W. Ulbricht began quietly with an indictment filed in a Maryland courthouse against an unidentified individual five months before the authorities made an arrest.,"The criminal case against Ross W. Ulbricht, the man who federal prosecutors contend is the mastermind behind the notorious Silk Road online marketplace for illegal drugs and hacked credit card numbers, began quietly with an indictment filed in a Maryland courthouse against an unidentified individual five months before the authorities made an arrest.",https://dealbook.nytimes.com/2014/03/21/silk-road-case-began-with-hunt-for-a-john-doe/
1169,2014-03-21 19:58:26+00:00,"Weekend Reading: March Madness, Wall St. Edition","A number of sides are facing off in our financial coverage of the past week. Since we’ve already blown our NCAA brackets, lets try out the concept with Wall Street.","A number of sides are facing off in our financial coverage of the past week. Since we’ve already blown our NCAA college basketball brackets, lets try out the concept with the news from Wall Street.",https://dealbook.nytimes.com/2014/03/21/weekend-reading-march-madness-wall-st-edition/
1170,2014-03-21 12:11:58+00:00,Mt. Gox Says It Found Missing Bitcoin Worth About $116 Million,"Mt. Gox, the Tokyo-based Bitcoin exchange that collapsed and filed for bankruptcy last month, said it had found 200,000 Bitcoins that were held in an “old-format wallet,” or digital storage file.","Updated, 8:04 p.m. | The seemingly miraculous discovery of about $116 million in missing Bitcoin, or 200,000 coins, late Thursday underscored the rickety early infrastructure that the digital currency is still trying to overcome.",https://dealbook.nytimes.com/2014/03/21/mt-gox-says-it-has-found-200000-bitcoins-worth-about-114-million/
1171,2014-03-21 11:16:42+00:00,Joining the 11-Digit Valuation Club,The couch-surfing company Airbnb is close to raising a funding round that would give it a valuation of more than $10 billion. | The chief executive of Time Warner Cable is set to receive nearly $80 million in severance payment. | The Fed released the results of its latest stress test — and all but one of the 30 banks under review passed. | Dominique Strauss-Kahn is seeking to start a $2 billion hedge fund.,"AIRBNB NEARS $10 BILLION VALUATION  |  The couch-surfing website Airbnb was once selling cereal boxes with presidential candidates’ faces just to stay afloat. Now, the company is close to joining a rarefied group of start-ups: the 11-digit valuation club, Michael J. de la Merced writes in DealBook. ",https://dealbook.nytimes.com/2014/03/21/morning-agenda-joining-the-11-digit-valuation-club/
1172,2014-03-20 13:05:22+00:00,Placing Their Bets on Bitcoin,Hong Kong entrepreneurs see a lucrative future in virtual money.,Hong Kong entrepreneurs see a lucrative future in virtual money.,https://json8.nytimes.com/slideshow/2014/03/20/business/dealbook/placing-their-bets-on-bitcoin.html
1173,2014-03-20 11:58:06+00:00,Questioning the Leverage Ratio,The New York Fed president’s concerns are said to have delayed a banking rule. | Questions about why seven Dewey & LeBoeuf employees who have pleaded guilty have not been identified. | The Federal Reserve is continuing to taper its bond-buying program. | JPMorgan Chase sells its physical commodities unit.,"Since the financial crisis, William C. Dudley, president of the Federal Reserve Bank of New York, has made significant changes to bolster the bank’s supervision efforts. But now, some regulators are blaming him for holding up a proposed rule to make banks safer, Peter Eavis writes in DealBook. Mr. Dudley is said to have privately expressed his concerns to senior Fed officials in Washington about the rule, known as the supplementary leverage ratio, frustrating other regulators who see it as a centerpiece of a financial system overhaul.",https://dealbook.nytimes.com/2014/03/20/morning-agenda-questioning-the-leverage-ratio/
1174,2014-03-20 11:50:07+00:00,Daily Report: Entrepreneurs in Hong Kong Place Their Bets on Bitcoin,"A growing number of technology experts, financial players and entrepreneurs believe that mainland China’s unfavorable regulation of Bitcoin has put Hong Kong on the edge of something big."," By day, David Shin is an investment banker at a major financial firm. By night and in pretty much every other free minute, he is an entrepreneur looking to break into Hong Kong’s growing Bitcoin scene, Alan Wong reports.",https://bits.blogs.nytimes.com/2014/03/20/daily-report-entrepreneurs-in-hong-kong-place-their-bets-on-bitcoin/
1175,2014-03-19 20:52:06+00:00,"In Hong Kong, Placing Their Bets on Bitcoin","A growing field of technology experts, financial players and entrepreneurs believe that mainland China’s unfavorable regulation of Bitcoin has put Hong Kong on the edge of something big."," HONG KONG — By day, David Shin is an investment banker at a major financial firm. By night and in pretty much every other free minute, he is an entrepreneur looking to break into Hong Kong’s growing Bitcoin scene.",https://dealbook.nytimes.com/2014/03/19/in-hong-kong-betting-big-on-bitcoin/
1176,2014-03-19 20:03:40+00:00,Placing Their Bets on Bitcoin,"A growing field of technology experts, financial players and entrepreneurs believe that mainland China’s unfavorable regulation of Bitcoin has put Hong Kong on the edge of something big.","HONG KONG — By day, David Shin is an investment banker at a major financial firm. By night and in pretty much every other free minute, he is an entrepreneur looking to break into Hong Kong’s growing Bitcoin scene.",https://www.nytimes.com/2014/03/20/business/international/in-hong-kong-betting-big-on-bitcoin.html
1177,2014-03-19 16:17:17+00:00,Can You Trust ‘Secure’ Messaging Apps?,Messaging apps and security are two of the hottest topics in tech. But can you trust the wave of supposedly secure messaging services coming out now? The New York Times’s Molly Wood talks to an expert.," It’s officially a post-Snowden and post-WhatsApp world, and my inbox is filled with pitches from companies promoting their secure messaging apps. But can you trust them? ",https://bits.blogs.nytimes.com/2014/03/19/can-you-trust-secure-messaging-apps/
1178,2014-03-19 11:54:21+00:00,More Scrutiny for Payday Lenders,A state by state battle against payday lenders is heating up. | Institutional investors join with activist hedge funds in the push for corporate control. | A court ruling calls into question whether an investment bank should pay the bill in a legal settlement while directors escape with nary a scratch. | The New York attorney general widens an inquiry of high-frequency trading.,"The battle is heating up against payday lenders and their practice of offering fast money to borrowers so desperate for cash that they are often willing to accept it at almost any terms, Jessica Silver-Greenberg and Rachel Abrams write in DealBook.",https://dealbook.nytimes.com/2014/03/19/morning-agenda-more-scrutiny-for-payday-lenders/
1179,2014-03-19 03:00:38+00:00,"Fortress, Benchmark and Ribbit  Buy Stake in Pantera Bitcoin",The partnership represents a significant step in the push to move Bitcoin into the financial mainstream.,Several prominent investment firms are joining forces to buy stakes in one of the biggest Bitcoin operations in the world.,https://dealbook.nytimes.com/2014/03/18/fortress-benchmark-and-ribbit-buy-stake-in-pantera-bitcoin/
1180,2014-03-18 11:45:10+00:00,Taking Aim at an Anonymous Blogger,David Einhorn’s case against the website Seeking Alpha could affect the future of business journalism. | Foreign investors in Russia are beginning to sound the alarm. | A boutique advisory firm played an important role in the Vodafone-Ono deal. | Turnover continues at SAC Capital Advisors.,"It may seem as though David Einhorn, the outspoken hedge fund manager, wants to have his cake and eat it, too. After an anonymous blogger on the website Seeking Alpha leaked one of his firm’s investments — a stake in Micron Technology — Mr. Einhorn’s firm, Greenlight Capital, asked a court to force the website to identify the writer by name. If Mr. Einhorn — a longtime champion of transparency when he singles out companies and other market participants — were to win, the result could limit the free flow of information to traditional news outlets and require sites like Seeking Alpha to not publish anonymous contributions, Andrew Ross Sorkin writes in the DealBook column.",https://dealbook.nytimes.com/2014/03/18/morning-agenda-taking-aim-at-an-anonymous-blogger/
1181,2014-03-18 00:28:57+00:00,Letter From Nakamoto on Bitcoin Claim,"“I did not create, invent or otherwise work on Bitcoin,” Dorian Satoshi Nakamoto said. “I unconditionally deny the Newsweek report.”","“I did not create, invent or otherwise work on Bitcoin,” Dorian Satoshi Nakamoto said. “I unconditionally deny the Newsweek report.”",https://www.nytimes.com/interactive/2014/03/17/business/media/18bitcoin-documents.html
1182,2014-03-17 12:44:19+00:00,Putative Bitcoin Founder Categorically Denies It ,"Dorian Nakamoto appeared to be laying the groundwork for a lawsuit against Newsweek, saying its article had harmed him. He stopped short of saying he would sue.","Around 10 days after being identified by Newsweek magazine as the mysterious creator of the digital currency Bitcoin, Dorian Nakamoto, a 64-year-old semi-employed engineer, has hired a lawyer and issued a statement unconditionally denying that he had any involvement in Bitcoin.",https://www.nytimes.com/2014/03/18/business/media/man-named-by-newsweek-issues-denial-on-bitcoin-claim.html
1183,2014-03-17 11:55:38+00:00,Alibaba’s New York State of Mind,Alibaba confirms it will begin the process of going public in New York. | Vodafone agrees to purchase the Spanish cable company Ono. | Investors are waiting to see the extent of Western sanctions on Russia after Crimea’s vote to secede from Ukraine. | The Justice Department put investigations of mortgage crime on the back burner.,"The Alibaba Group, China’s online commerce giant, says it plans to begin the process of going public in New York, Michael J. de la Merced writes in DealBook. The long-awaited initial public offering could be one of the biggest ever and could eventually raise more than the $16 billion that Facebook secured nearly two years ago. Analysts estimate that Alibaba could reach a valuation upward of $130 billion.",https://dealbook.nytimes.com/2014/03/17/morning-agenda-alibaba-to-go-public-in-new-york/
1184,2014-03-15 16:23:45+00:00,The Threats That Help PayPal,"EBay’s PayPal is innovating fast, spurred by threats from several directions."," The best thing that happened to PayPal in years may also be why it has turned into a Wall Street football: a big upswing in innovation, fed by the prospect of irrelevance.",https://bits.blogs.nytimes.com/2014/03/15/the-threats-that-help-paypal/
1185,2014-03-14 20:20:17+00:00,Start-Up Seeks to Capitalize on Security Concerns for Bitcoins,"Xapo, a start-up from a tech entrepreneur promises security, backed by an insurer, to store Bitcoins.","After living with hyperinflation, currency fluctuations and minimal access to credit in his country, Wences Casares, an Argentine raised on a sheep farm, says he has the vision and team to make Bitcoin more widespread and accepted worldwide.",https://dealbook.nytimes.com/2014/03/14/start-up-seeks-to-capitalize-on-security-concerns-for-bitcoins/
1186,2014-03-14 11:51:18+00:00,S.E.C. Takes Aim at Another Former SAC Employee,The S.E.C. unveiled a civil case against a 10th former SAC Capital employee. | An internal investigation found that the Justice Department had repeatedly and significantly overstated its efforts to prosecute mortgage fraud. | G.E. filed to spin off its North American retail finance unit in an initial public offering. | Lions Gate agreed to admit to wrongdoing and pay a $7.5 million fine for failing to disclose how it stopped a takeover by Carl C. Icahn in 2010.,"S.E.C. TAKES AIM AT 10TH FORMER SAC EMPLOYEE  |  The Securities and Exchange Commission’s investigation into Steven A. Cohen’s hedge fund, SAC Capital Advisors, isn’t done just yet. Federal regulators announced on Thursday a civil case against Ronald N. Dennis, who worked for SAC for less than two years, for prompting a number of illegal trades stemming from confidential tips he received about two technology companies, Dell and Foundry Networks, Ben Protess and Matthew Goldstein write in DealBook. Mr. Dennis, the 10th former employee of SAC to face civil or criminal insider trading charges, settled with the S.E.C., agreeing to be banned from the securities industry and to pay $200,000.",https://dealbook.nytimes.com/2014/03/14/morning-agenda-s-e-c-takes-aim-at-another-former-sac-employee/
1187,2014-03-14 10:51:23+00:00,China Puts a Stop to Plans for Virtual Credit Cards,China’s central bank said it wanted to assess the risks that customers could face using the untested services from the online giants Alibaba and Tencent.,"HONG KONG — China’s central bank has ordered the Internet giants Alibaba and Tencent to halt plans to issue virtual credit cards in partnership with a large Chinese bank, citing concern over safety risks.",https://www.nytimes.com/2014/03/15/business/international/china-virtual-credit-cards.html
1188,2014-03-14 05:37:51+00:00,"Corrections: March 14, 2014","Corrections appearing in print on March 14, 2014.",FRONT PAGE,https://www.nytimes.com/2014/03/14/pageoneplus/corrections-march-14-2014.html
1189,2014-03-13 17:00:54+00:00,Today in Small Business: Clueless Sales Representatives,Why celebrities are entering the wine business. And how to manage a budget.,"What’s affecting me, my clients and other small-business owners today.",https://boss.blogs.nytimes.com/2014/03/13/today-in-small-business-clueless-sales-representatives/
1190,2014-03-12 15:25:09+00:00,Today in Small Business: Yelp Gets Negative Reviews,The president looks to expand overtime pay. Getting customer feedback. Google’s first retail store. And Disney’s ultimate tweet.,"What’s affecting me, my clients and other small-business owners today:",https://boss.blogs.nytimes.com/2014/03/12/today-in-small-business-yelp-gets-negative-reviews/
1191,2014-03-12 12:15:18+00:00,A Look at Citi’s Challenges in Mexico,Citigroup’s troubles in Mexico illustrate the challenges of emerging markets. | No mention of its founder in Men’s Wearhouse’s deal announcement. | SAC Capital Advisors gets a new name. | Herbalife shares fell after William A. Ackman accused the company of “operating illegally” in China.,"In the financial crisis year of 2008, Citigroup severed ties to Mexican companies that it feared could imperil its Mexican affiliate, but it seems that those efforts did not go far enough, Michael Corkery and Jessica Silver-Greenberg write in DealBook. A $400 million fraud at Citigroup’s Banamex unit that was discovered last month highlights the limitations of that kind of culling, and underscores the challenges of finding solid lending clients in a country where the line between big business and political cronyism can become blurred.",https://dealbook.nytimes.com/2014/03/12/morning-agenda-a-look-at-citis-challenges-in-mexico/
1192,2014-03-11 23:10:18+00:00,A Turnaround for Bitcoin at SXSW,"For Bitcoin entrepreneurs, the rise from scrappy outsiders to tech world insiders has been a bit dizzying.","AUSTIN, Tex. — At last year’s South by Southwest gathering, regarded as the place where are the hip technology companies showed up, Bitcoin was still such an underdog that it was not important enough to command a single event or panel.",https://dealbook.nytimes.com/2014/03/11/a-turnaround-for-bitcoin-at-sxsw/
1193,2014-03-11 19:57:41+00:00,Will the Real Satoshi Nakamoto Please Stand Up?,"Particularly in Japan, those named Satoshi Nakamoto have been garnering a lot of attention as the search continues for the creator of Bitcoin.","TOKYO — Satoshi Nakamoto of Fujisawa, Japan, is a shoe repairman.",https://dealbook.nytimes.com/2014/03/11/will-the-real-satoshi-nakamoto-please-stand-up/
1194,2014-03-11 19:34:38+00:00,Virtual Exchange Plans Are Sought in New York,"Benjamin Lawsky, the superintendent of New York’s Department of Financial Services, issued his first public order on virtual currencies like Bitcoin, calling for proposals for creating regulated exchanges.","Updated, 8:48 p.m. | At a time when some government agencies are backing away from virtual currency, New York’s top financial regulator is taking a big step forward.",https://dealbook.nytimes.com/2014/03/11/new-york-financial-regulator-solicits-virtual-currency-proposals/
1195,2014-03-11 16:00:07+00:00,Bitcoin Foundation Bolsters Its Ranks,"Jim Harper of the Cato Institute will act as government liaison, as regulators struggle with how to oversee the evolving world of digital currency. Amy Weiss, a former White House deputy press secretary, was also brought on as an outside consultant.",The Bitcoin Foundation is adding to its ranks as regulators around the world struggle with how to oversee the evolving world of digital currency.,https://dealbook.nytimes.com/2014/03/11/bitcoin-foundation-bolsters-its-ranks/
1196,2014-03-11 11:53:39+00:00,Icahn’s Fight Against eBay,Marc Andreessen has become a target of Carl C. Icahn. | Positive News for Puerto Rico on the sale of roughly $3 billion in bonds. | Chiquita to become the king of bananas with a deal for an Irish fruit company. | The Blackstone Group and TPG Capital are said to be joining forces in a bid for Gates Global.,"Marc Andreessen, the entrepreneur turned technology investor, has recently been caught in the verbal cross hairs of the activist investor Carl C. Icahn, Andrew Ross Sorkin writes in the DealBook column. The war of words stems from Mr. Icahn’s campaign to pressure eBay, the online auction company, to spin off its electronic payment unit PayPal. Among other things, he has accused Mr. Andreessen, an eBay board member, of various conflicts of interest that affected eBay’s sale of Skype in 2009 for $2.75 billion to a group of investors that included Mr. Andreessen’s venture capital firm.",https://dealbook.nytimes.com/2014/03/11/morning-agenda-icahns-fight-against-ebay/
1197,2014-03-10 22:07:45+00:00,"At SXSW Conference, a Mother Presses Her Son’s Case","Ross Ulbricht was arrested in October and charged with operating the Silk Road, the online drug bazaar where Bitcoin was the only money accepted. His mother, Lyn, hopes that the crowd at SXSW would be receptive to her son’s cause.","Among the tech start-ups pitching their ideas at SXSW this week, there was a mother, advocating not a new company but the cause of her son.",https://dealbook.nytimes.com/2014/03/10/at-sxsw-conference-a-mother-presses-her-sons-case/
1198,2014-03-10 19:30:51+00:00,Morgan Stanley Chief Calls Bitcoin ‘Surreal’,"James P. Gorman, the chief executive of Morgan Stanley, said in a television interview on Monday that he did not have a firm grasp of the virtual currency.","To its devotees, Bitcoin represents the future of transactions. But the financial establishment is still scratching its head over the virtual currency.",https://dealbook.nytimes.com/2014/03/10/morgan-stanley-chief-calls-bitcoin-surreal/
1199,2014-03-10 15:55:12+00:00,Today in Small Business: The Stars of Vine,Financiers opening sweet shops. A Colorado entrepreneur sells marijuana-infused products. The buying power of people older than 50.,"What’s affecting me, my clients and other small-business owners today.",https://boss.blogs.nytimes.com/2014/03/10/today-in-small-business-the-stars-of-vine/
1200,2014-03-10 12:34:04+00:00,Ackman’s Battle to Bring Down Herbalife,"William A. Ackman and his lobbying effort to bring down Herbalife. | Documents point to mortgage lapses at Credit Suisse. | A judge rules against R.B.C. over the lender’s advice in a 2011 buyout. | Bankers go to great lengths to get credit for deals, even if they did not advise on them.","After staking $1 billion on the collapse of the nutritional supplement company Herbalife, William A. Ackman’s activist hedge fund, Pershing Square Capital Management, has been lobbying aggressively to bring it down, Michael S. Schmidt, Eric Lipton and Alexandra Stevenson write in The New York Times. Others have criticized the business practices of Herbalife, which sells vitamins and other supplements through independent distributors, but Mr. Ackman’s attack is “unprecedented in its scale,” they write. For its part, Herbalife continues to strongly deny his accusations that the company is a pyramid scheme.",https://dealbook.nytimes.com/2014/03/10/morning-agenda-ackmans-battle-to-bring-down-herbalife/
1201,2014-03-08 02:10:53+00:00,Newsweek Returns to Print and Sets Off a Bitcoin Storm,"The magazine’s story claiming to have uncovered the founder of the digital currency drew a wave of attention, much of it negative.","After being out of print for 14 months, Newsweek wanted its return to the newsstands to land with a splash. So it put out an issue with a darkened cover featuring a theatrical silver mask, and made an explosive claim: It had uncovered the mysterious founder of the digital currency Bitcoin.",https://www.nytimes.com/2014/03/08/business/media/newsweek-returns-to-print-and-sets-off-a-bitcoin-storm.html
